{
  "active_decisions": [
    {
      "evidence": [],
      "id": "D-046",
      "path": "docs/workstreams/messenger-governance-closure-v3/DECISIONS.md",
      "reason": "Move workflow ordering from the human procedure to the /work controller",
      "source_sha256": "afd8b57e36fd122f120346cf5d4b05a6b0d5030d7b04dac9e8c73cd76458b825",
      "status": "active"
    },
    {
      "evidence": [],
      "id": "D-051",
      "path": "docs/workstreams/messenger-governance-closure-v3/DECISIONS.md",
      "reason": "Install AMPLAI Loop Kit 2.1.0 as a removable layer, not a replacement",
      "source_sha256": "afd8b57e36fd122f120346cf5d4b05a6b0d5030d7b04dac9e8c73cd76458b825",
      "status": "active"
    },
    {
      "evidence": [],
      "id": "D-052",
      "path": "docs/workstreams/messenger-governance-closure-v3/DECISIONS.md",
      "reason": "The Project Store owns the supervisor's code and its right to run",
      "source_sha256": "afd8b57e36fd122f120346cf5d4b05a6b0d5030d7b04dac9e8c73cd76458b825",
      "status": "active"
    },
    {
      "evidence": [],
      "id": "D-053",
      "path": "docs/workstreams/messenger-governance-closure-v3/DECISIONS.md",
      "reason": "amplai-foundry owns the kit source and distributes it to the other apps",
      "source_sha256": "afd8b57e36fd122f120346cf5d4b05a6b0d5030d7b04dac9e8c73cd76458b825",
      "status": "active"
    },
    {
      "evidence": [],
      "id": "D-054",
      "path": "docs/workstreams/messenger-governance-closure-v3/DECISIONS.md",
      "reason": "Relax cortex's .ai-team top-level guard to allow the kit's three, not delete it",
      "source_sha256": "afd8b57e36fd122f120346cf5d4b05a6b0d5030d7b04dac9e8c73cd76458b825",
      "status": "active"
    },
    {
      "evidence": [],
      "id": "D-055",
      "path": "docs/workstreams/messenger-governance-closure-v3/DECISIONS.md",
      "reason": "Make Claude Code and Codex first-class hosts without forking the loop",
      "source_sha256": "afd8b57e36fd122f120346cf5d4b05a6b0d5030d7b04dac9e8c73cd76458b825",
      "status": "active"
    },
    {
      "evidence": [],
      "id": "D-057",
      "path": "docs/workstreams/messenger-governance-closure-v3/DECISIONS.md",
      "reason": "Make stranded limit an output cap so filtered reads report truncation",
      "source_sha256": "afd8b57e36fd122f120346cf5d4b05a6b0d5030d7b04dac9e8c73cd76458b825",
      "status": "active"
    },
    {
      "evidence": [],
      "id": "MGC-012",
      "path": "docs/workstreams/messenger-governance-closure-v3/DECISIONS.md",
      "reason": "Messenger governance closure — Slack interaction authority and proposal cards",
      "source_sha256": "afd8b57e36fd122f120346cf5d4b05a6b0d5030d7b04dac9e8c73cd76458b825",
      "status": "active"
    },
    {
      "evidence": [],
      "id": "amplai-constitution",
      "path": ".specify/memory/constitution.md",
      "reason": "AMPLAI foundry constitution",
      "source_sha256": "d20cfafcdd1ec488107c67987e7697ef6d63052a29895ef099bf60af0284db19",
      "status": "active"
    }
  ],
  "code_scope": [
    "deployment/limits-qualification-artifacts/",
    "deployment/local-limits-qualification.json",
    "scripts/limits_qualify.py",
    "scripts/opencode_qualify.py",
    "specs/015-external-qualification/",
    "specs/017-external-qualification-closure/",
    "src/amplai_foundry/agent_drivers/",
    "tests/ai/test_amplai_kit_regressions.py",
    "tests/v3/"
  ],
  "content_hash": "55d65d8175e2fbec7d760c2b11f83d9772a7df30482c5c9777a52935f7c56de7",
  "generated_from": {
    "claims_sha256": "8dca0671686b1b88a40ad4e5307cf5fe6ff2728e09d4042bc8d3a5299455f9c2",
    "commit": "575f51dacba49931712e084f3b8f2b1d38bd82d8",
    "contract_sha256": "48b0fc0ab843e4fcd68dfefdf2b1e4b57fa4668b96dad984e22a1d89b52b8519",
    "decisions_sha256": "8a22d5c739d5a47a7c0dcebfccf0d4fecfaa34da9269b77fa2d432eacc91c50d",
    "discovery_sha256": "",
    "document_selection_sha256": "d503f59ba4d87af3cfb76a6171471974098490dd50fb737e6f6a23d7b2032e88",
    "generated_at": "2026-09-27T03:29:26Z",
    "knowledge_map_sha256": "32c54054154f4513a1ded352b587d8ef1a0aa10dc0084855bfb6324726219eb4",
    "readiness_sha256": "179e36940b6c727e12d61940c972ae1d389254640fa78abdea3431f9eac8968c",
    "worktree_dirty": true,
    "worktree_state": "WORKTREE"
  },
  "goal": "외부 자격 미해결 항목 중 이 workstation 에서 실측 가능한 것(OpenCode 실제 server turn, 컨테이너 resource limit, main CI flaky)을 측정하고, 측정으로 드러난 driver 결함을 regression test 먼저 고친 뒤 ledger 에 사실대로 기록한다.",
  "knowledge_verdict": "READY",
  "ontology_refs": [],
  "required_knowledge": [
    {
      "evidence": [],
      "id": "verifier-registry",
      "path": ".ai-team/verifiers/registry.json",
      "reason": "keyword:test,ai",
      "source_sha256": "28fd7b916a0affe70ef8967bf33e7ef1d3e9ed9888fccea1a1cc3acc29720f2a",
      "status": "active"
    },
    {
      "evidence": [],
      "id": "loop-runtime-policy",
      "path": ".ai-team/runtime/policy.json",
      "reason": "keyword:ai",
      "source_sha256": "de4d8eac14b786a9ef2be3347600312ff7a6be9622f8b603339c08ccbd7ed727",
      "status": "active"
    },
    {
      "evidence": [],
      "id": "loop-runtime-workflow",
      "path": ".ai-team/runtime/WORKFLOW.md",
      "reason": "keyword:ai",
      "source_sha256": "ba01eba7b38f03ad123da997ff6c3eeab2dbaecfef7047e312645555a705107e",
      "status": "active"
    },
    {
      "evidence": [],
      "id": "constitution",
      "path": ".specify/memory/constitution.md",
      "reason": "keyword:ci",
      "source_sha256": "d20cfafcdd1ec488107c67987e7697ef6d63052a29895ef099bf60af0284db19",
      "status": "active"
    },
    {
      "evidence": [],
      "id": "loop-runtime-readme",
      "path": ".ai-team/README.md",
      "reason": "keyword:ai",
      "source_sha256": "6f9b1c00884ec20b7de422dbdfc3ba5b75b58b720eed480d84458cf6609cd4da",
      "status": "active"
    },
    {
      "evidence": [],
      "id": "root-agent-contract",
      "path": "AGENTS.md",
      "reason": "high-priority-core",
      "source_sha256": "d920e716d080a6e460b1001651f7dc1c5c56101b2ab3d87858599929db7bc6e3",
      "status": "active"
    },
    {
      "evidence": [],
      "id": "root-claude-contract",
      "path": "CLAUDE.md",
      "reason": "high-priority-core",
      "source_sha256": "2ed55443211783c046519245aae74e3b3372e27d64f32622e9bac81901640829",
      "status": "active"
    },
    {
      "evidence": [
        {
          "locator": "What Was Not Ported",
          "path": "AGENTS.md",
          "source_sha256": "d920e716d080a6e460b1001651f7dc1c5c56101b2ab3d87858599929db7bc6e3",
          "type": "doc"
        },
        {
          "locator": "D-046",
          "path": "docs/workstreams/messenger-governance-closure-v3/DECISIONS.md",
          "source_sha256": "afd8b57e36fd122f120346cf5d4b05a6b0d5030d7b04dac9e8c73cd76458b825",
          "type": "decision"
        }
      ],
      "id": "claim-semantic-runtime-not-ported",
      "path": "AGENTS.md",
      "reason": "active claim",
      "source_sha256": "d920e716d080a6e460b1001651f7dc1c5c56101b2ab3d87858599929db7bc6e3",
      "status": "active"
    },
    {
      "evidence": [
        {
          "locator": "Work Memory",
          "path": ".ai-team/README.md",
          "source_sha256": "6f9b1c00884ec20b7de422dbdfc3ba5b75b58b720eed480d84458cf6609cd4da",
          "type": "doc"
        },
        {
          "path": ".ai-team/contracts/work-contract.schema.json",
          "source_sha256": "7c748fa2f3b7308646aba30c76e378dce9ea292cf24ee3808ddfcfd492db2896",
          "type": "artifact"
        }
      ],
      "id": "claim-work-artifact-isolation",
      "path": ".ai-team/README.md",
      "reason": "active claim",
      "source_sha256": "6f9b1c00884ec20b7de422dbdfc3ba5b75b58b720eed480d84458cf6609cd4da",
      "status": "active"
    }
  ],
  "schema_version": "1.0",
  "test_scope": [
    "tests/ai/test_amplai_kit_regressions.py"
  ],
  "unknowns": [],
  "verifier_profile": "v2",
  "work_id": "AMPLAI-V3-RC05"
}
