{
  "active_decisions": [],
  "code_scope": [
    "tools/amplai-loop-kit/",
    "scripts/loopctl.py",
    "scripts/loopv2.py",
    "scripts/amplai.py",
    "scripts/amplai_runtime.py",
    "scripts/amplai_docs.py",
    "scripts/eval.sh",
    "tests/ai/",
    ".ai-team/runtime/",
    ".ai-team/policy/documentation.json",
    ".ai-team/policy/gardening.json",
    ".ai-team/verifiers/",
    ".agents/skills/work/",
    ".agents/skills/design/",
    ".agents/skills/dev-loop/",
    "README.md",
    "docs/",
    "specs/012-portable-document-lifecycle/",
    ".specify/feature.json",
    ".ai-team/README.md",
    ".ai-team/contracts/",
    ".ai-team/knowledge/README.md",
    ".ai-team/knowledge/map.json",
    ".ai-team/knowledge/claims.jsonl",
    ".ai-team/knowledge/doc-impact.schema.json",
    ".ai-team/knowledge/context-pack.schema.json",
    ".ai-team/knowledge/garden-report.schema.json",
    ".agents/skills/taskify/",
    ".specify/scripts/",
    ".specify/templates/",
    "pyproject.toml"
  ],
  "content_hash": "c5affbefd3f83cd69d999d985ebb57af1de84490aa3d8a75b429baa50c69ca73",
  "generated_from": {
    "claims_sha256": "8dca0671686b1b88a40ad4e5307cf5fe6ff2728e09d4042bc8d3a5299455f9c2",
    "commit": "6e005a5e3035ef05510c403a7cd691d524b733bd",
    "contract_sha256": "71fe10c0afe9c5023d4df154016d1690a0cd90a0ae37351de2e3c8f8994270e5",
    "decisions_sha256": "8a22d5c739d5a47a7c0dcebfccf0d4fecfaa34da9269b77fa2d432eacc91c50d",
    "discovery_sha256": "411d805c8134bc6da50927ab42f4ab1ace8c1fff029cc1b11b6679ddd44a562f",
    "document_selection_sha256": "0a497f242641428459c1891bdecd85507cc0253fa7fa40916871f1891ab65fa0",
    "generated_at": "2026-09-11T07:04:16Z",
    "knowledge_map_sha256": "9a7cb461c9ea4a239be2060a29a4caf956049c98609ab1d8d892d1d4c87cc9f4",
    "readiness_sha256": "c413e7122cfb47debff0646b2aa99affa5659c871b4d90586d3eb8a6b8d64093",
    "worktree_dirty": true,
    "worktree_state": "WORKTREE"
  },
  "goal": "Preserve work/design and repository-local rules while delivering a runnable portable baseline, dependency-bound versioned documentation and safe offline HTML through the canonical Foundry Kit.",
  "knowledge_verdict": "READY",
  "ontology_refs": [],
  "required_knowledge": [
    {
      "evidence": [],
      "id": "loop-runtime-policy",
      "path": ".ai-team/runtime/policy.json",
      "reason": "keyword:work,ai,ai-team,runtime,policy",
      "source_sha256": "de4d8eac14b786a9ef2be3347600312ff7a6be9622f8b603339c08ccbd7ed727",
      "status": "active"
    },
    {
      "evidence": [],
      "id": "verifier-registry",
      "path": ".ai-team/verifiers/registry.json",
      "reason": "keyword:ai,ai-team,verifiers",
      "source_sha256": "28fd7b916a0affe70ef8967bf33e7ef1d3e9ed9888fccea1a1cc3acc29720f2a",
      "status": "active"
    },
    {
      "evidence": [
        {
          "locator": "profiles",
          "path": ".ai-team/verifiers/registry.json",
          "source_sha256": "28fd7b916a0affe70ef8967bf33e7ef1d3e9ed9888fccea1a1cc3acc29720f2a",
          "type": "artifact"
        },
        {
          "locator": "doctor - verifier profile 집합 불일치",
          "path": "scripts/loopctl.py",
          "source_sha256": "76f60991de86c5eae431ecb38f938374bc5fd70fb3888fd1249b6cc8e9522534",
          "type": "code"
        }
      ],
      "id": "claim-verifier-profile-single-source",
      "path": ".ai-team/verifiers/registry.json",
      "reason": "active claim",
      "source_sha256": "28fd7b916a0affe70ef8967bf33e7ef1d3e9ed9888fccea1a1cc3acc29720f2a",
      "status": "active"
    }
  ],
  "schema_version": "1.0",
  "test_scope": [
    "tests/ai/test_amplai_async_runtime.py",
    "tests/ai/test_amplai_federation.py",
    "tests/ai/test_amplai_host_adapters.py",
    "tests/ai/test_amplai_kit_installer.py",
    "tests/ai/test_amplai_kit_regressions.py",
    "tests/fixtures/codex-workflow/01-new-concept.md",
    "tests/fixtures/codex-workflow/02-concept-update.md",
    "tests/fixtures/codex-workflow/03-decision-conflict.md",
    "tests/fixtures/codex-workflow/04-duplicate.md",
    "tests/fixtures/codex-workflow/05-open-question.md",
    "tests/fixtures/codex-workflow/06-mixed-long-response.md",
    "tests/fixtures/codex-workflow/README.md",
    "tests/test_work_activation.py",
    "tests/test_work_status_projection.py"
  ],
  "unknowns": [],
  "verifier_profile": "v2",
  "work_id": "CR-SYNAPSE-APP-SPLIT-W003"
}
